[
  {
    "credentialId": "az-104",
    "examCode": "AZ-104",
    "currentName": "Microsoft Certified: Azure Administrator Associate",
    "dungeonName": "The Infrastructure Keep",
    "credentialType": "certification",
    "provider": "Microsoft",
    "productAreas": ["Azure", "Infrastructure"],
    "personas": [
      "infrastructure-engineer",
      "solutions-architect",
      "network-engineer",
      "devops-engineer"
    ],
    "level": "Associate",
    "status": "active",
    "officialUrls": {
      "credential": "https://learn.microsoft.com/en-us/credentials/certifications/azure-administrator/",
      "exam": "https://learn.microsoft.com/en-us/credentials/certifications/azure-administrator/",
      "studyGuide": "https://learn.microsoft.com/en-us/credentials/certifications/resources/study-guides/az-104",
      "training": "https://learn.microsoft.com/en-us/training/courses/az-104t00"
    },
    "objectiveVersion": "April 17, 2026",
    "lastGroundedAt": "2026-09-11T19:17:30.061Z",
    "lastValidatedAt": "2026-09-11T19:53:01.900Z",
    "supportedQuestionTypes": [
      "single-select",
      "multi-select",
      "true-false",
      "scenario",
      "code"
    ],
    "verifiedQuestionCount": 30,
    "minimumPlayableQuestionCount": 25,
    "contentReadiness": "limited",
    "disclaimer": "Unofficial study aid; not a vendor-endorsed exam or practice assessment.",
    "themeMetadata": {
      "biome": "Stone citadel",
      "bossName": "The Configuration Warden",
      "art": null
    },
    "isVerified": true,
    "sourceAllowlist": [
      {
        "host": "learn.microsoft.com",
        "pathPrefixes": [],
        "exactUrls": [
          "https://learn.microsoft.com/en-us/azure/role-based-access-control/scope-overview",
          "https://learn.microsoft.com/en-us/azure/role-based-access-control/built-in-roles",
          "https://learn.microsoft.com/en-us/azure/azure-resource-manager/management/lock-resources",
          "https://learn.microsoft.com/en-us/azure/governance/policy/concepts/effect-basics",
          "https://learn.microsoft.com/en-us/azure/storage/common/storage-sas-overview",
          "https://learn.microsoft.com/en-us/azure/storage/common/storage-redundancy",
          "https://learn.microsoft.com/en-us/azure/storage/blobs/lifecycle-management-overview",
          "https://learn.microsoft.com/en-us/azure/storage/blobs/object-replication-overview",
          "https://learn.microsoft.com/en-us/azure/app-service/deploy-staging-slots",
          "https://learn.microsoft.com/en-us/azure/container-apps/scale-app",
          "https://learn.microsoft.com/en-us/azure/virtual-machines/disks-enable-host-based-encryption-portal",
          "https://learn.microsoft.com/en-us/azure/azure-resource-manager/templates/deployment-modes",
          "https://learn.microsoft.com/en-us/azure/virtual-network/network-security-groups-overview",
          "https://learn.microsoft.com/en-us/azure/virtual-network/virtual-networks-udr-overview",
          "https://learn.microsoft.com/en-us/azure/azure-monitor/alerts/alerts-processing-rules",
          "https://learn.microsoft.com/en-us/azure/site-recovery/site-recovery-test-failover-to-azure",
          "https://learn.microsoft.com/en-us/entra/identity/authentication/tutorial-enable-sspr",
          "https://learn.microsoft.com/en-us/azure/governance/policy/how-to/remediate-resources",
          "https://learn.microsoft.com/en-us/azure/role-based-access-control/overview",
          "https://learn.microsoft.com/en-us/azure/storage/blobs/soft-delete-blob-overview",
          "https://learn.microsoft.com/en-us/azure/azure-resource-manager/templates/resource-dependency",
          "https://learn.microsoft.com/en-us/azure/virtual-machines/sizes/resize-vm",
          "https://learn.microsoft.com/en-us/azure/container-instances/container-instances-restart-policy",
          "https://learn.microsoft.com/en-us/azure/app-service/overview-private-endpoint",
          "https://learn.microsoft.com/en-us/azure/app-service/overview-vnet-integration",
          "https://learn.microsoft.com/en-us/azure/dns/private-dns-virtual-network-links",
          "https://learn.microsoft.com/en-us/azure/load-balancer/load-balancer-custom-probe-overview",
          "https://learn.microsoft.com/en-us/azure/azure-monitor/platform/diagnostic-settings",
          "https://learn.microsoft.com/en-us/azure/backup/soft-delete-virtual-machines"
        ]
      }
    ],
    "verificationEvidence": [
      {
        "url": "https://learn.microsoft.com/en-us/credentials/certifications/azure-administrator/",
        "title": "Microsoft Certified: Azure Administrator Associate",
        "retrievedAt": "2026-09-11T19:17:29.578Z",
        "summary": "HTTP 200; rendered metadata identifies \"Microsoft Certified: Azure Administrator Associate\". The page positively offers \"Schedule through Pearson Vue\" and a \"Schedule exam\" link with examUid=exam.AZ-104. Active means currently offered on this official page, not inferred from the supplied list, a recent date, or the absence of a retirement label. No booking or tenant access was performed."
      },
      {
        "url": "https://learn.microsoft.com/en-us/credentials/certifications/resources/study-guides/az-104",
        "title": "Study guide for Exam AZ-104: Microsoft Azure Administrator",
        "retrievedAt": "2026-09-11T19:14:24.828Z",
        "summary": "Official study guide explicitly states \"Skills measured as of April 17, 2026\". Domain weights, skill headings, and subskills are extracted only from that section, excluding Audience profile, Skills at a glance, resources, and change logs."
      },
      {
        "url": "https://learn.microsoft.com/en-us/training/courses/az-104t00",
        "title": "Microsoft Azure Administrator",
        "retrievedAt": "2026-09-11T19:14:24.948Z",
        "summary": "Official preparation course captured through Microsoft Learn MCP: Microsoft Azure Administrator. Training material corroborates preparation and identity, not active status."
      }
    ]
  },
  {
    "credentialId": "az-120",
    "examCode": "AZ-120",
    "currentName": "Microsoft Certified: Azure for SAP Workloads Specialty",
    "dungeonName": "The SAP Stronghold",
    "credentialType": "certification",
    "provider": "Microsoft",
    "productAreas": ["Azure", "SAP"],
    "personas": [
      "infrastructure-engineer",
      "solutions-architect",
      "sap-infrastructure-engineer"
    ],
    "level": "Specialty",
    "status": "active",
    "officialUrls": {
      "credential": "https://learn.microsoft.com/en-us/credentials/certifications/azure-for-sap-workloads-specialty/",
      "exam": "https://learn.microsoft.com/en-us/credentials/certifications/azure-for-sap-workloads-specialty/",
      "studyGuide": "https://learn.microsoft.com/en-us/credentials/certifications/resources/study-guides/az-120",
      "training": "https://learn.microsoft.com/en-us/training/courses/az-120t00"
    },
    "objectiveVersion": "April 17, 2026",
    "lastGroundedAt": "2026-09-11T19:17:30.075Z",
    "lastValidatedAt": "2026-09-11T19:53:01.934Z",
    "supportedQuestionTypes": [
      "single-select",
      "multi-select",
      "true-false",
      "scenario",
      "code"
    ],
    "verifiedQuestionCount": 0,
    "minimumPlayableQuestionCount": 25,
    "contentReadiness": "unavailable",
    "disclaimer": "Unofficial study aid; not a vendor-endorsed exam or practice assessment.",
    "themeMetadata": {
      "biome": "Mountain fortress",
      "bossName": "The Workload Sentinel",
      "art": null
    },
    "isVerified": true,
    "sealedReason": "Sealed dungeon - its identity and current map are verified, but an independently reviewed encounter package has not yet been carved.",
    "sourceAllowlist": [
      {
        "host": "learn.microsoft.com",
        "pathPrefixes": ["/en-us/"],
        "exactUrls": []
      }
    ],
    "verificationEvidence": [
      {
        "url": "https://learn.microsoft.com/en-us/credentials/certifications/azure-for-sap-workloads-specialty/",
        "title": "Microsoft Certified: Azure for SAP Workloads Specialty",
        "retrievedAt": "2026-09-11T19:17:29.646Z",
        "summary": "HTTP 200; rendered metadata identifies \"Microsoft Certified: Azure for SAP Workloads Specialty\". The page positively offers \"Schedule through Pearson Vue\" and a \"Schedule exam\" link with examUid=exam.AZ-120. Active means currently offered on this official page, not inferred from the supplied list, a recent date, or the absence of a retirement label. No booking or tenant access was performed."
      },
      {
        "url": "https://learn.microsoft.com/en-us/credentials/certifications/resources/study-guides/az-120",
        "title": "Study guide for Exam AZ-120: Planning and Administering Azure for SAP Workloads",
        "retrievedAt": "2026-09-11T19:14:26.843Z",
        "summary": "Official study guide explicitly states \"Skills measured as of April 17, 2026\". Domain weights, skill headings, and subskills are extracted only from that section, excluding Audience profile, Skills at a glance, resources, and change logs."
      },
      {
        "url": "https://learn.microsoft.com/en-us/training/courses/az-120t00",
        "title": "Planning and Deploying SAP on Azure",
        "retrievedAt": "2026-09-11T19:14:27.144Z",
        "summary": "Official preparation course captured through Microsoft Learn MCP: Planning and Deploying SAP on Azure. Training material corroborates preparation and identity, not active status."
      }
    ]
  },
  {
    "credentialId": "az-305",
    "examCode": "AZ-305",
    "currentName": "Microsoft Certified: Azure Solutions Architect Expert",
    "dungeonName": "The Architect's Labyrinth",
    "credentialType": "certification",
    "provider": "Microsoft",
    "productAreas": ["Azure", "Architecture"],
    "personas": [
      "infrastructure-engineer",
      "solutions-architect",
      "network-engineer"
    ],